{"_type":"export","__export_format":4,"__export_date":"2023-06-02T05:31:34.276Z","__export_source":"insomnia.desktop.app:v2023.2.2","resources":[{"_id":"req_64f78a1f37504d20bb120639edf5db69","parentId":"wrk_f20a632ddce44f6c97701d4131a507a7","modified":1685682309254,"created":1685470719658,"url":"http://localhost:8000/api/message/store","name":"Send Message","description":"","method":"POST","body":{"mimeType":"application/json","text":"{\n\t\"chat_id\" : 1,\n\t\"content\" : \"Test Passed\",\n\t\"username\" : \"Mário Lucas\"\n}"},"parameters":[],"headers":[{"name":"Content-Type","value":"application/json","id":"pair_bc325c9f894e4177bab7927e853f5050"},{"id":"pair_3f384ea2dba34b03ace90cfc9fb82920","name":"Accept","value":"application/json","description":""}],"authentication":{},"metaSortKey":-1685470719658,"isPrivate":false,"settingStoreCookies":true,"settingSendCookies":true,"settingDisableRenderRequestBody":false,"settingEncodeUrl":true,"settingRebuildPath":true,"settingFollowRedirects":"global","_type":"request"},{"_id":"wrk_f20a632ddce44f6c97701d4131a507a7","parentId":null,"modified":1684510197532,"created":1684510197532,"name":"New Document","description":"","scope":"design","_type":"workspace"},{"_id":"req_8652e9f289ef4989ba92aaae0506e7e9","parentId":"wrk_f20a632ddce44f6c97701d4131a507a7","modified":1685681768254,"created":1685469622852,"url":"http://localhost:8000/api/chat/1/details","name":"Get Chat Details","description":"","method":"GET","body":{"mimeType":"application/json","text":""},"parameters":[],"headers":[{"name":"Content-Type","value":"application/json","id":"pair_0e86c6a92bfa4ca1a65c11d7fee48b16"},{"id":"pair_cf0bf6d76d924a29bb458c7c6c410806","name":"Accept","value":"application/json","description":""}],"authentication":{},"metaSortKey":-1685469622852,"isPrivate":false,"settingStoreCookies":true,"settingSendCookies":true,"settingDisableRenderRequestBody":false,"settingEncodeUrl":true,"settingRebuildPath":true,"settingFollowRedirects":"global","_type":"request"},{"_id":"req_9c0a6af3df704cf1a67c3ca29b272db6","parentId":"wrk_f20a632ddce44f6c97701d4131a507a7","modified":1685571651179,"created":1685571646593,"url":"http://localhost:8000/api/chats","name":"Get Chat Actives","description":"","method":"GET","body":{"mimeType":"application/json","text":""},"parameters":[],"headers":[{"name":"Content-Type","value":"application/json","id":"pair_0e86c6a92bfa4ca1a65c11d7fee48b16"},{"id":"pair_cf0bf6d76d924a29bb458c7c6c410806","name":"Accept","value":"application/json","description":""}],"authentication":{},"metaSortKey":-1685460085288.25,"isPrivate":false,"settingStoreCookies":true,"settingSendCookies":true,"settingDisableRenderRequestBody":false,"settingEncodeUrl":true,"settingRebuildPath":true,"settingFollowRedirects":"global","_type":"request"},{"_id":"req_e84e5235fc4f407d8e0e3f2d67e0482c","parentId":"wrk_f20a632ddce44f6c97701d4131a507a7","modified":1685682141371,"created":1685503844776,"url":"http://localhost:8000/api/message/100","name":"Get Chat Messages","description":"","method":"GET","body":{"mimeType":"application/json","text":""},"parameters":[],"headers":[{"name":"Content-Type","value":"application/json","id":"pair_0e86c6a92bfa4ca1a65c11d7fee48b16"},{"id":"pair_cf0bf6d76d924a29bb458c7c6c410806","name":"Accept","value":"application/json","description":""}],"authentication":{},"metaSortKey":-1685450547724.5,"isPrivate":false,"settingStoreCookies":true,"settingSendCookies":true,"settingDisableRenderRequestBody":false,"settingEncodeUrl":true,"settingRebuildPath":true,"settingFollowRedirects":"global","_type":"request"},{"_id":"req_60771d64aa954e19b896760a879ce5c1","parentId":"wrk_f20a632ddce44f6c97701d4131a507a7","modified":1685682045789,"created":1685491569345,"url":"http://127.0.0.1:8000/api/chat/5/close","name":"Chat Close","description":"","method":"PUT","body":{"mimeType":"application/json","text":"{\n\t\n}"},"parameters":[],"headers":[{"name":"Content-Type","value":"application/json"}],"authentication":{},"metaSortKey":-1685431472597,"isPrivate":false,"settingStoreCookies":true,"settingSendCookies":true,"settingDisableRenderRequestBody":false,"settingEncodeUrl":true,"settingRebuildPath":true,"settingFollowRedirects":"global","_type":"request"},{"_id":"req_0acb003a4fb5409d946be6fdcc7720ee","parentId":"wrk_f20a632ddce44f6c97701d4131a507a7","modified":1685681860329,"created":1685393322341,"url":"http://127.0.0.1:8000/api/chat","name":"Chat Start","description":"","method":"POST","body":{"mimeType":"application/json","text":"{\n\t\"username\": \"Mário Lucas\",\n\t\"title\" : \"Babilônia em chamas!\"\n}"},"parameters":[],"headers":[{"name":"Content-Type","value":"application/json","id":"pair_02fcc06a92fd4e5ea5fad8e587eff612","disabled":false},{"id":"pair_14208da3a0a34fdd8f4d88e43c60ba08","name":"Accept","value":"application/json","description":""}],"authentication":{},"metaSortKey":-1685393322342,"isPrivate":false,"settingStoreCookies":true,"settingSendCookies":true,"settingDisableRenderRequestBody":false,"settingEncodeUrl":true,"settingRebuildPath":true,"settingFollowRedirects":"global","_type":"request"},{"_id":"env_d0646079a71953d2c69e55a29105465974cf2558","parentId":"wrk_f20a632ddce44f6c97701d4131a507a7","modified":1684510197560,"created":1684510197560,"name":"Base Environment","data":{},"dataPropertyOrder":null,"color":null,"isPrivate":false,"metaSortKey":1684510197560,"_type":"environment"},{"_id":"jar_d0646079a71953d2c69e55a29105465974cf2558","parentId":"wrk_f20a632ddce44f6c97701d4131a507a7","modified":1685682302574,"created":1684510197566,"name":"Default Jar","cookies":[{"key":"XSRF-TOKEN","value":"eyJpdiI6ImRJZGZQdkNQQlJONm4rTXQvbWUycGc9PSIsInZhbHVlIjoibWNJbU5yWWpKUFlzTVdpbE5mclRMMlpSYi9DK05MTWlRQkVlTEpPd0oyZGllRWJ1V1M2ODV5dGljNEh1WlBUbHVsSXRyNHAzQnNaQWdwa3lETDVxcU1zdHpQNzhHYzRKZVdVL0VqKzY1RFhCT3ByYXpDKzlaUHpRazBUKzcrcnEiLCJtYWMiOiIxM2IyN2U3ZWU1NzFjOWFhMmFiNTFiODU0ZTVmZGI0MDQxNmZmZjU2MGU3Y2MwNWFmY2M2NDdiMzBmMDZkMjg5IiwidGFnIjoiIn0%3D","expires":"2023-05-30T19:41:00.000Z","maxAge":7200,"domain":"localhost","path":"/","extensions":["samesite=lax"],"hostOnly":true,"creation":"2023-05-30T17:39:31.299Z","lastAccessed":"2023-05-30T17:41:00.847Z","id":"5428028225312247"},{"key":"laravel_session","value":"eyJpdiI6IlBScW1OdXlsdHJmRXBzSDY0UjQvYWc9PSIsInZhbHVlIjoiVlNUb0JNSVJXN2NCM3ZOc3cvd1UxeDliU1J3MS8wZVB5dk1zK1h2YkpOakExa1JHYW9JNklKL3JNcG1WZGY2T1FqSCtZNkJ0eHozNlFjNXVFMHhodysybS9iZjdLbWxCVEpCZDMwSDR1S1dYN3N2NkhCN09tNWQraTlwUUcvbEYiLCJtYWMiOiIyNzM0MTI0YWJjYmFjMGVlNmQxNzI2Yzc2NjBhNjBiMjM5MDUzNTcwOTQ4OTNkYzEyMWNjY2I0ZjVhM2MxY2I1IiwidGFnIjoiIn0%3D","expires":"2023-06-02T07:05:02.000Z","maxAge":7200,"domain":"localhost","path":"/","httpOnly":true,"extensions":["samesite=lax"],"hostOnly":true,"creation":"2023-05-30T17:39:31.300Z","lastAccessed":"2023-06-02T05:05:02.572Z","id":"5178945299551585"},{"key":"XSRF-TOKEN","value":"eyJpdiI6IlI0VHhWdHREVUllWHU2OGo1OVVaL3c9PSIsInZhbHVlIjoicUZET09CSk5mT0U3Y1hrdTBUVWRMOFVpUTZrc3dibWYvSk1ObE95UFdZRFIzc2g2bnZJVmFKZTQvQmVWV081Tk1LbFdLM29XN3dLbzhkVGtia3Bnamw0cWlZVW1DeW5NUEMzc0IrL2tqU1V0cE1kcjRDZU42WkVhaWZadzNwTk8iLCJtYWMiOiJhNDY5MDM5NThjMDk1N2Y3MjNkZDUxMDFmZTk5MjgyMmMxZmFlNmQ1ZjM1NWEwNzhiMTE3MDEyMTVmNjg5OGQyIiwidGFnIjoiIn0%3D","expires":"2023-05-31T02:42:20.000Z","maxAge":7200,"domain":"127.0.0.1","path":"/","extensions":["samesite=lax"],"hostOnly":true,"creation":"2023-05-31T00:40:10.495Z","lastAccessed":"2023-05-31T00:42:20.415Z","id":"22157874277213208"},{"key":"laravel_session","value":"eyJpdiI6InJzVEkyUjM3U01hVnRlUldMRHV0N3c9PSIsInZhbHVlIjoiUklwYnUyTHZEUm5GUkZTaXAwcWVYbWtFM2dFRUxJSFJpcWFPYlAyVmM0cmhaVndhcjR3Q1FzZ29BTHY0bFZ2RWVjaTVrZnF4R1BTc3luKzllSmVVU2l2UVZTQVcza0NWb0xTQnp1d0ZCdUZ0elE1V1hXeU90UU51VkZCcUtvTmkiLCJtYWMiOiJkMGE2ZDk1YTM5OTYzNTVhYmVlODhlOTk5ZWQ5YmY0ODU0YzRjNDU4ZWE2ZWVhNjFhNjNkY2MxYmZiYTI1NjVmIiwidGFnIjoiIn0%3D","expires":"2023-06-02T07:00:47.000Z","maxAge":7200,"domain":"127.0.0.1","path":"/","httpOnly":true,"extensions":["samesite=lax"],"hostOnly":true,"creation":"2023-05-31T00:40:10.496Z","lastAccessed":"2023-06-02T05:00:47.857Z","id":"17108089844706753"}],"_type":"cookie_jar"},{"_id":"spc_2f368103fc0f473ab99c4844f606f266","parentId":"wrk_f20a632ddce44f6c97701d4131a507a7","modified":1685683850309,"created":1685680205442,"fileName":"Hypeone API Requests","contents":"_type: export\n__export_format: 4\n__export_date: 2023-06-02T04:23:17.729Z\n__export_source: insomnia.desktop.app:v2023.2.2\nresources:\n  - _id: req_64f78a1f37504d20bb120639edf5db69\n    parentId: wrk_f20a632ddce44f6c97701d4131a507a7\n    modified: 1685672991638\n    created: 1685470719658\n    url: http://localhost:8000/api/message/store\n    name: Send Message\n    description: \"\"\n    method: POST\n    body:\n      mimeType: application/json\n      text: |-\n        {\n        \t\"chat_id\" : 1,\n        \t\"content\" : \"Test Passed\",\n        \t\"username\" : \"Mário Lucas\"\n        }\n    parameters: []\n    headers:\n      - name: Content-Type\n        value: application/json\n        id: pair_bc325c9f894e4177bab7927e853f5050\n      - id: pair_3f384ea2dba34b03ace90cfc9fb82920\n        name: Accept\n        value: application/json\n        description: \"\"\n    authentication: {}\n    metaSortKey: -1685470719658\n    isPrivate: false\n    settingStoreCookies: true\n    settingSendCookies: true\n    settingDisableRenderRequestBody: false\n    settingEncodeUrl: true\n    settingRebuildPath: true\n    settingFollowRedirects: global\n    _type: request\n  - _id: wrk_f20a632ddce44f6c97701d4131a507a7\n    parentId: null\n    modified: 1684510197532\n    created: 1684510197532\n    name: New Document\n    description: \"\"\n    scope: design\n    _type: workspace\n  - _id: req_8652e9f289ef4989ba92aaae0506e7e9\n    parentId: wrk_f20a632ddce44f6c97701d4131a507a7\n    modified: 1685543085127\n    created: 1685469622852\n    url: http://localhost:8000/api/chat/1/details\n    name: Get Chat Details\n    description: \"\"\n    method: GET\n    body:\n      mimeType: application/json\n      text: \"\"\n    parameters: []\n    headers:\n      - name: Content-Type\n        value: application/json\n        id: pair_0e86c6a92bfa4ca1a65c11d7fee48b16\n      - id: pair_cf0bf6d76d924a29bb458c7c6c410806\n        name: Accept\n        value: application/json\n        description: \"\"\n    authentication: {}\n    metaSortKey: -1685469622852\n    isPrivate: false\n    settingStoreCookies: true\n    settingSendCookies: true\n    settingDisableRenderRequestBody: false\n    settingEncodeUrl: true\n    settingRebuildPath: true\n    settingFollowRedirects: global\n    _type: request\n  - _id: req_9c0a6af3df704cf1a67c3ca29b272db6\n    parentId: wrk_f20a632ddce44f6c97701d4131a507a7\n    modified: 1685571651179\n    created: 1685571646593\n    url: http://localhost:8000/api/chats\n    name: Get Chat Actives\n    description: \"\"\n    method: GET\n    body:\n      mimeType: application/json\n      text: \"\"\n    parameters: []\n    headers:\n      - name: Content-Type\n        value: application/json\n        id: pair_0e86c6a92bfa4ca1a65c11d7fee48b16\n      - id: pair_cf0bf6d76d924a29bb458c7c6c410806\n        name: Accept\n        value: application/json\n        description: \"\"\n    authentication: {}\n    metaSortKey: -1685460085288.25\n    isPrivate: false\n    settingStoreCookies: true\n    settingSendCookies: true\n    settingDisableRenderRequestBody: false\n    settingEncodeUrl: true\n    settingRebuildPath: true\n    settingFollowRedirects: global\n    _type: request\n  - _id: req_e84e5235fc4f407d8e0e3f2d67e0482c\n    parentId: wrk_f20a632ddce44f6c97701d4131a507a7\n    modified: 1685641058864\n    created: 1685503844776\n    url: http://localhost:8000/api/message/1\n    name: Get Chat Messages\n    description: \"\"\n    method: GET\n    body:\n      mimeType: application/json\n      text: \"\"\n    parameters: []\n    headers:\n      - name: Content-Type\n        value: application/json\n        id: pair_0e86c6a92bfa4ca1a65c11d7fee48b16\n      - id: pair_cf0bf6d76d924a29bb458c7c6c410806\n        name: Accept\n        value: application/json\n        description: \"\"\n    authentication: {}\n    metaSortKey: -1685450547724.5\n    isPrivate: false\n    settingStoreCookies: true\n    settingSendCookies: true\n    settingDisableRenderRequestBody: false\n    settingEncodeUrl: true\n    settingRebuildPath: true\n    settingFollowRedirects: global\n    _type: request\n  - _id: req_60771d64aa954e19b896760a879ce5c1\n    parentId: wrk_f20a632ddce44f6c97701d4131a507a7\n    modified: 1685674626852\n    created: 1685491569345\n    url: http://127.0.0.1:8000/api/chat/9/close\n    name: Chat Close\n    description: \"\"\n    method: PUT\n    body:\n      mimeType: application/json\n      text: |-\n        {\n        \t\"name\" : \"Mário Lucas\"\n        }\n    parameters: []\n    headers:\n      - name: Content-Type\n        value: application/json\n    authentication: {}\n    metaSortKey: -1685431472597\n    isPrivate: false\n    settingStoreCookies: true\n    settingSendCookies: true\n    settingDisableRenderRequestBody: false\n    settingEncodeUrl: true\n    settingRebuildPath: true\n    settingFollowRedirects: global\n    _type: request\n  - _id: req_0acb003a4fb5409d946be6fdcc7720ee\n    parentId: wrk_f20a632ddce44f6c97701d4131a507a7\n    modified: 1685678812743\n    created: 1685393322341\n    url: http://127.0.0.1:8000/api/chat\n    name: Chat Start\n    description: \"\"\n    method: POST\n    body:\n      mimeType: application/json\n      text: |-\n        {\n        \t\"username\": \"Mário Lucas\",\n        \t\"title\" : \"Babilônia em chamas!\"\n        }\n    parameters: []\n    headers:\n      - name: Content-Type\n        value: application/json\n        id: pair_02fcc06a92fd4e5ea5fad8e587eff612\n        disabled: false\n      - id: pair_14208da3a0a34fdd8f4d88e43c60ba08\n        name: Accept\n        value: application/json\n        description: \"\"\n    authentication: {}\n    metaSortKey: -1685393322342\n    isPrivate: false\n    settingStoreCookies: true\n    settingSendCookies: true\n    settingDisableRenderRequestBody: false\n    settingEncodeUrl: true\n    settingRebuildPath: true\n    settingFollowRedirects: global\n    _type: request\n  - _id: env_d0646079a71953d2c69e55a29105465974cf2558\n    parentId: wrk_f20a632ddce44f6c97701d4131a507a7\n    modified: 1684510197560\n    created: 1684510197560\n    name: Base Environment\n    data: {}\n    dataPropertyOrder: null\n    color: null\n    isPrivate: false\n    metaSortKey: 1684510197560\n    _type: environment\n  - _id: jar_d0646079a71953d2c69e55a29105465974cf2558\n    parentId: wrk_f20a632ddce44f6c97701d4131a507a7\n    modified: 1685679741351\n    created: 1684510197566\n    name: Default Jar\n    cookies:\n      - key: XSRF-TOKEN\n        value: eyJpdiI6ImRJZGZQdkNQQlJONm4rTXQvbWUycGc9PSIsInZhbHVlIjoibWNJbU5yWWpKUFlzTVdpbE5mclRMMlpSYi9DK05MTWlRQkVlTEpPd0oyZGllRWJ1V1M2ODV5dGljNEh1WlBUbHVsSXRyNHAzQnNaQWdwa3lETDVxcU1zdHpQNzhHYzRKZVdVL0VqKzY1RFhCT3ByYXpDKzlaUHpRazBUKzcrcnEiLCJtYWMiOiIxM2IyN2U3ZWU1NzFjOWFhMmFiNTFiODU0ZTVmZGI0MDQxNmZmZjU2MGU3Y2MwNWFmY2M2NDdiMzBmMDZkMjg5IiwidGFnIjoiIn0%3D\n        expires: 2023-05-30T19:41:00.000Z\n        maxAge: 7200\n        domain: localhost\n        path: /\n        extensions:\n          - samesite=lax\n        hostOnly: true\n        creation: 2023-05-30T17:39:31.299Z\n        lastAccessed: 2023-05-30T17:41:00.847Z\n        id: \"7991040969817573\"\n      - key: laravel_session\n        value: eyJpdiI6InVhT280TDBaS1pleS91R0pTb3ljQUE9PSIsInZhbHVlIjoidldoRnpzTXJoeENydXlONXNpMHFsQzJRSjI3aHE3aWFHa3h0M1E4ejNaVEtGZFdQMWJSNmRocmVYaExtVzFJcDdpRVVBOFF0d0g2MExtTTFHeE0xMllRRnpzWWRvQ05Hc1hJVlc4WkRFSkxPL1lTVjk3QktPNXdnZzZqTENYQWgiLCJtYWMiOiIyMWIwZGQzOGJhZmEzOTE2MDRhNGM3ZWM2NDYzNjFjMTAyMzE5ZGU4NzA2NDY0MThkMTY2M2JiYmY0MTUzNDc2IiwidGFnIjoiIn0%3D\n        expires: 2023-06-02T06:22:21.000Z\n        maxAge: 7200\n        domain: localhost\n        path: /\n        httpOnly: true\n        extensions:\n          - samesite=lax\n        hostOnly: true\n        creation: 2023-05-30T17:39:31.300Z\n        lastAccessed: 2023-06-02T04:22:21.350Z\n        id: \"535942668311959\"\n      - key: XSRF-TOKEN\n        value: eyJpdiI6IlI0VHhWdHREVUllWHU2OGo1OVVaL3c9PSIsInZhbHVlIjoicUZET09CSk5mT0U3Y1hrdTBUVWRMOFVpUTZrc3dibWYvSk1ObE95UFdZRFIzc2g2bnZJVmFKZTQvQmVWV081Tk1LbFdLM29XN3dLbzhkVGtia3Bnamw0cWlZVW1DeW5NUEMzc0IrL2tqU1V0cE1kcjRDZU42WkVhaWZadzNwTk8iLCJtYWMiOiJhNDY5MDM5NThjMDk1N2Y3MjNkZDUxMDFmZTk5MjgyMmMxZmFlNmQ1ZjM1NWEwNzhiMTE3MDEyMTVmNjg5OGQyIiwidGFnIjoiIn0%3D\n        expires: 2023-05-31T02:42:20.000Z\n        maxAge: 7200\n        domain: 127.0.0.1\n        path: /\n        extensions:\n          - samesite=lax\n        hostOnly: true\n        creation: 2023-05-31T00:40:10.495Z\n        lastAccessed: 2023-05-31T00:42:20.415Z\n        id: \"8322771269333784\"\n      - key: laravel_session\n        value: eyJpdiI6ImpQSHpDdUJFSElRaUUvcGMxb3AzSnc9PSIsInZhbHVlIjoiVnZJV2VMdFRhSE90aUdSVFV6Z0JuZ0UvQXdQL1d2VHI3NE9ZYVBjdVhoYlgweFZwTnFQMVB6OFFlNEJiYnhxSytpZS9rNS90NEdwWnFVLzJJNm5YdHpFVnRsSTVZSTV4cTdVdlFDYkpKU1poYTBHdTdld3V1MzdZVzBsQWt4bWMiLCJtYWMiOiI3MjI5ODJlNDViOTQ0MzMwOTk5ODU5ZGRhOTRlNjBmYjUzZDZjZjhlZDc3M2IyZDU0NDdkNjExNTI2NjlkOGMzIiwidGFnIjoiIn0%3D\n        expires: 2023-06-02T06:22:04.000Z\n        maxAge: 7200\n        domain: 127.0.0.1\n        path: /\n        httpOnly: true\n        extensions:\n          - samesite=lax\n        hostOnly: true\n        creation: 2023-05-31T00:40:10.496Z\n        lastAccessed: 2023-06-02T04:22:04.680Z\n        id: \"6338315002530881\"\n    _type: cookie_jar\n  - _id: spc_2f368103fc0f473ab99c4844f606f266\n    parentId: wrk_f20a632ddce44f6c97701d4131a507a7\n    modified: 1685662293446\n    created: 1684510197534\n    fileName: New Document\n    contents: \"\"\n    contentType: yaml\n    _type: api_spec\n  - _id: uts_c82d0c34e29d43dfba3d584db95b02b7\n    parentId: wrk_f20a632ddce44f6c97701d4131a507a7\n    modified: 1684510197590\n    created: 1684510197590\n    name: Example Test Suite\n    _type: unit_test_suite\n","contentType":"yaml","_type":"api_spec"},{"_id":"uts_c82d0c34e29d43dfba3d584db95b02b7","parentId":"wrk_f20a632ddce44f6c97701d4131a507a7","modified":1684510197590,"created":1684510197590,"name":"Example Test Suite","_type":"unit_test_suite"},{"_id":"uts_f0cd0226544b46a78a0aafd37d381bd0","parentId":"wrk_f20a632ddce44f6c97701d4131a507a7","modified":1684510197590,"created":1684510197590,"name":"Example Test Suite","_type":"unit_test_suite"}]}